{
  "program_id": "engineering-maturity-2026",
  "as_of_date": "2026-02-26",
  "window_days": 7,
  "owner": "platform-engineering",
  "overall_score": 84.5,
  "score_breakdown": [
    {
      "dimension": "reliability",
      "weight": 20,
      "score": 18.5,
      "evidence": "417/417 tests passing from pytest + coverage baseline run on 2026-02-26."
    },
    {
      "dimension": "security",
      "weight": 15,
      "score": 10.5,
      "evidence": "Security scanning exists in CI, but API-backed high-severity alert count is not yet wired into dashboard automation."
    },
    {
      "dimension": "performance",
      "weight": 15,
      "score": 13.5,
      "evidence": "Docker smoke p95 endpoint latency is 25.955 ms and benchmark simulation p95 runtime is 0.263235 s."
    },
    {
      "dimension": "quality",
      "weight": 15,
      "score": 13.0,
      "evidence": "Line coverage is 86.35 percent with CI gate at 82 percent."
    },
    {
      "dimension": "reproducibility",
      "weight": 10,
      "score": 5.0,
      "evidence": "Current generated fidelity reports in outputs show fail status and require remediation before promotion confidence."
    },
    {
      "dimension": "operability",
      "weight": 10,
      "score": 8.0,
      "evidence": "Runbooks and SLO docs exist; dashboard automation and alert routing are still being hardened."
    },
    {
      "dimension": "governance",
      "weight": 10,
      "score": 8.5,
      "evidence": "Release workflows, schema contracts, and milestone/epic tracking are now versioned in-repo."
    },
    {
      "dimension": "ecosystem",
      "weight": 5,
      "score": 3.5,
      "evidence": "Cross-language parity exists but broader external integration playbooks remain in progress."
    }
  ],
  "slis": {
    "availability_pct": 100.0,
    "api_p95_latency_ms": 25.955,
    "simulation_runtime_p95_sec": 0.263235,
    "coverage_pct": 86.35,
    "test_pass_rate_pct": 100.0,
    "fidelity_gate_pass_rate_pct": 0.0,
    "open_high_sev_vulns": 0
  },
  "risks": [
    {
      "id": "RISK-2026-001",
      "severity": "critical",
      "summary": "Fidelity gate pass rate is currently 0 percent in generated report artifacts.",
      "mitigation": "Prioritize EPIC-06 with trace-by-trace failure analysis and threshold/calibration remediation before any promotion claims."
    },
    {
      "id": "RISK-2026-002",
      "severity": "medium",
      "summary": "Security high-severity counts are not machine-ingested into KPI snapshots yet.",
      "mitigation": "Add automated security export ingestion into the KPI generation workflow for milestone reviews."
    }
  ],
  "actions": [
    {
      "id": "ACT-2026-001",
      "owner": "ml-systems",
      "due_date": "2026-04-30",
      "description": "Raise fidelity gate pass rate from 0 percent to >= 98 percent on reference suite.",
      "status": "in_progress"
    },
    {
      "id": "ACT-2026-002",
      "owner": "sre",
      "due_date": "2026-03-20",
      "description": "Automate KPI snapshot generation from CI evidence artifacts.",
      "status": "planned"
    },
    {
      "id": "ACT-2026-003",
      "owner": "security",
      "due_date": "2026-03-20",
      "description": "Expose open high-severity vulnerability counts in a consumable JSON artifact for governance dashboards.",
      "status": "planned"
    }
  ],
  "notes": "Baseline snapshot generated on 2026-02-26 from local CI-equivalent test run and existing benchmark/smoke artifacts."
}
