{
  "program_id": "engineering-maturity-2026",
  "as_of_date": "2026-02-27",
  "window_days": 7,
  "owner": "platform-engineering",
  "overall_score": 88.2,
  "score_breakdown": [
    {
      "dimension": "reliability",
      "weight": 20,
      "score": 18.9,
      "evidence": "420/420 tests passing with deterministic replay checks in CI."
    },
    {
      "dimension": "security",
      "weight": 15,
      "score": 12.2,
      "evidence": "Bandit, pip-audit, and secret scan remain mandatory CI checks."
    },
    {
      "dimension": "performance",
      "weight": 15,
      "score": 13.4,
      "evidence": "Benchmark and load-test lanes remain green; p95 budgets still being tightened."
    },
    {
      "dimension": "quality",
      "weight": 15,
      "score": 14.5,
      "evidence": "Coverage gate raised to 86% with package floors (api/models/simulate) and warnings-as-errors policy."
    },
    {
      "dimension": "reproducibility",
      "weight": 10,
      "score": 8.9,
      "evidence": "OpenAPI compatibility, readiness validation, and artifact evidence bundle added to CI."
    },
    {
      "dimension": "operability",
      "weight": 10,
      "score": 8.2,
      "evidence": "Runbooks and readiness checks are active; ops drill cadence continues."
    },
    {
      "dimension": "governance",
      "weight": 10,
      "score": 8.6,
      "evidence": "Engineering maturity KPI snapshot cadence and issue tracking are active."
    },
    {
      "dimension": "ecosystem",
      "weight": 5,
      "score": 3.5,
      "evidence": "Cross-language parity checks are stable; external deployment playbooks still expanding."
    }
  ],
  "slis": {
    "availability_pct": 100.0,
    "api_p95_latency_ms": 25.955,
    "simulation_runtime_p95_sec": 0.263235,
    "coverage_pct": 86.14,
    "test_pass_rate_pct": 100.0,
    "fidelity_gate_pass_rate_pct": 0.0,
    "open_high_sev_vulns": 0
  },
  "risks": [
    {
      "id": "RISK-2026-003",
      "severity": "medium",
      "summary": "LightGBM feature-name warnings still require temporary allowlist entries.",
      "mitigation": "Burn down warning allowlist under KPI-GAP-WARN-ALLOWLIST and enforce zero-warning goal."
    },
    {
      "id": "RISK-2026-004",
      "severity": "medium",
      "summary": "Module coverage floors are close to threshold for simulate package.",
      "mitigation": "Add targeted tests for low-coverage simulate branches before next threshold ratchet."
    }
  ],
  "actions": [
    {
      "id": "ACT-2026-004",
      "owner": "qa-release",
      "due_date": "2026-03-15",
      "description": "Remove temporary warning allowlist for LightGBM feature-name warnings.",
      "status": "in_progress"
    },
    {
      "id": "ACT-2026-005",
      "owner": "simulation-core",
      "due_date": "2026-03-20",
      "description": "Raise simulate package coverage margin above 87 percent with branch-focused tests.",
      "status": "planned"
    }
  ],
  "notes": "Snapshot updated after CI quality-gate hardening (coverage floors, warning policy, docs consistency, and evidence artifacts)."
}
